{
  "schemaVersion": "1.0",
  "runId": "run_01JQXK0000000000000000001",
  "episode": {
    "schemaVersion": "1.0",
    "episodeId": "show:example-show:episode:episode-a",
    "showId": "example-show"
  },
  "workflowId": "workflow-a",
  "workflowVersion": "1.0.0",
  "status": "created",
  "knowledgePacks": [],
  "createdAt": "2026-01-01T00:00:00.000Z",
  "updatedAt": "2026-01-01T00:00:00.000Z"
}
